key,es
t1.169,"Referencia del valor 'lmat'. Las opciones incluyen: 'Base de peces, Base de vida marina, Artículo de revista'."
t1.170,"Tipo de longitud de medición para el valor' final_lmax'. Las opciones incluyen: 'TL = largo total, SL = largo estándar, WD = ancho, CL = largo del caparazón, CW = ancho del caparazón, ML = largo del manto, ShL = largo del caparazón'."
t1.171,"Longitud máxima final (cm) por especie utilizada en los cálculos, ya sea de la columna 'lmax' o de la columna' lmax_tl ' en función del tipo de longitud deseado."
t1.172,"Valor 'loo' calculado usando el valor 'final_lmax' en la fórmula "" = ( 10^(0.044 + 0.9841 *LOG10(final_lmax)))"""
t1.173,"La longitud al vencimiento se estima utilizando el valor calculado de la columna' calc_loo', utilizando la fórmula""=(10^(0.8979 * LOG10 (calc_loo) - 0.0782))"""
t1.174,Valor de longitud final al vencimiento (cm) basado en el cálculo en la columna 'calc_lmat' redondeado al décimo más cercano.
t1.175,"Cálculo para determinar el límite de longitud mínima, calculado automáticamente en Smartsheet usando la fórmula ""= [lmat_final] @ row * 0.5"""
t1.176,"Límite máximo de longitud (cm) utilizado para las advertencias de valor en función del valor 'final_lmax', calculado automáticamente en Smartsheet utilizando la fórmula ""=[final_lmax]@row"""
t1.177,"Límite de longitud mínima (cm) utilizado para las advertencias de valor en función del valor 'calc_limit_min', calculado automáticamente en Smartsheet utilizando la fórmula""=[calc_limit_min]@row"""
t1.178,"Límite de peso máximo (kg) utilizado para las advertencias de valor en función de los valores 'length_limit_max', 'a' y 'b', calculados automáticamente en Smartsheet utilizando la fórmula ""=(([length_limit_max] @ row ^ b@row) * a@row) / 1000"""
t1.179,"Límite de peso mínimo (kg) utilizado para las advertencias de valor en función de los valores 'length_limit_min', 'a' y 'b', calculados automáticamente en Smartsheet utilizando la fórmula""=(([length_limit_min] @ row ^ b@row) * a@row) / 1000"""
t1.180,"Peso promedio (kg), calculado automáticamente en Smartsheet usando la fórmula ""=([límite de peso máximo]@fila + [límite de peso mínimo]@fila) / 2"""
t1.181,Referencia o fórmula para el valor 'avg_weight'
t1.182,"VERDADERO / PRESENTE (1) o FALSO / AUSENTE( 0), obtenido de la columna 'Oceánico' en la tbl 'ecología' de fishbase."
t1.183,"VERDADERO/PRESENTE (1) o FALSO / AUSENTE( 0), obtenido de la columna 'Arrecifes de coral' en la tbl 'ecología' de fishbase."
t1.184,"VERDADERO / PRESENTE (1) o FALSO/AUSENTE (0), obtenido de la columna 'Manglares' en la tbl 'ecología' de fishbase."
t1.185,"VERDADERO / PRESENTE (1) o FALSO/AUSENTE (0), obtenido de la columna 'Lechos de pastos marinos' en el tbl 'ecología' de fishbase."
t1.186,"VERDADERO / PRESENTE (1) o FALSO/AUSENTE (0), obtenido de la columna 'Lodo' en la tbl 'ecología' de fishbase."
t1.187,"VERDADERO / PRESENTE (1) o FALSO/AUSENTE (0), obtenido de la columna 'Arena' en la tbl 'ecología' de fishbase."
t1.188,"VERDADERO / PRESENTE (1) o FALSO/AUSENTE (0), obtenido de la columna 'Estuarios' en la tbl 'ecología' de fishbase."
faq,Preguntas Frecuentes:
q1,"Una vez que agrego un nuevo administrador1, ¿cuánto tiempo tarda en aparecer en el menú desplegable de administrador2?"
a1,"Pasarán aproximadamente 15 minutos antes de que las nuevas entradas estén disponibles en los menús desplegables dinámicos. Esto se aplica al menú desplegable admin2 en admin3_ref, al menú desplegable species_group en gear_ref, al menú desplegable admin3 en buyer_ref, fisher_ref, data_collector, etc. Consulte la Figura 5 para ver la lista completa de menús desplegables dinámicos y su flujo de trabajo a través de los archivos de referencia."
q2,"Una vez que agrego o actualizo un archivo de referencia, ¿cuánto tiempo tarda en aparecer las actualizaciones en las encuestas de Kobo?"
a2,Debería ver un formulario de Kobo actualizado en aproximadamente 12-24 horas.
q3,"¿Cómo se deben registrar los nombres de compradores, pescadores y recolectores de datos?"
a3,"Idealmente, los nombres deben ser lo más exclusivos posible para el individuo e incluir su nombre, apellido y apodo. Si una persona no desea compartir su apellido completo, también puede usar la primera inicial o la primera letra de su apellido."
fig5,Conexión desplegable dinámica entre archivos de referencia.
